{
  "uuid": "d635a8e4-af40-4849-87ed-de1a6d93c81b",
  "id": "ses-cvd-classic",
  "title": "Socioeconomic Status and Cardiovascular Disease",
  "context": {
    "population": "general-adults",
    "geographic": "global",
    "era": "1990s-present"
  },
  "graph": {
    "nodes": [
      {
        "uuid": "a9adb251-2acb-4365-a535-d1904b1a30cd",
        "id": "socioeconomic_status",
        "role": "exposure"
      },
      {
        "uuid": "bc8ac5c3-c1f5-4c94-ad12-20eef368fc99",
        "id": "cardiovascular_disease",
        "role": "outcome"
      },
      {
        "uuid": "066426d8-371c-4395-a89a-ab35c207e357",
        "id": "healthcare_access",
        "role": "mediator"
      },
      {
        "uuid": "51f12da0-c714-40ed-b3a8-1ea57fc92564",
        "id": "health_behaviors",
        "role": "mediator"
      },
      {
        "uuid": "ef0b2cc0-9544-4171-9d2b-4a9c5184b954",
        "id": "psychosocial_stress",
        "role": "mediator"
      },
      {
        "uuid": "1dab0d8b-1f8a-48e5-8059-31ad7fb6c568",
        "id": "age",
        "role": "covariate"
      },
      {
        "uuid": "637d7d50-5e0b-4b39-9d31-9e03379f1a41",
        "id": "sex",
        "role": "covariate"
      }
    ],
    "edges": [
      {
        "uuid": "e9f262c9-e0a6-4fdf-9f4c-4a380b6924c1",
        "from": "socioeconomic_status",
        "to": "healthcare_access",
        "evidence": "strong"
      },
      {
        "uuid": "acc50f0e-0ff5-4eb8-932d-af1608d69ef9",
        "from": "socioeconomic_status",
        "to": "health_behaviors",
        "evidence": "strong"
      },
      {
        "uuid": "218a96fc-8d8d-4adc-9b94-277cfb3e263b",
        "from": "socioeconomic_status",
        "to": "psychosocial_stress",
        "evidence": "strong"
      },
      {
        "uuid": "b560af6a-89f2-4fbb-b299-a47e5faa041a",
        "from": "healthcare_access",
        "to": "cardiovascular_disease",
        "evidence": "strong"
      },
      {
        "uuid": "6b0e5714-ba28-4763-9ceb-44530ee100ad",
        "from": "health_behaviors",
        "to": "cardiovascular_disease",
        "evidence": "strong"
      },
      {
        "uuid": "d98f5977-c4ee-4697-9a2c-beab54f4356e",
        "from": "psychosocial_stress",
        "to": "cardiovascular_disease",
        "evidence": "moderate"
      },
      {
        "uuid": "85646038-f472-4c72-82e3-e15f112722db",
        "from": "socioeconomic_status",
        "to": "cardiovascular_disease",
        "evidence": "moderate"
      },
      {
        "uuid": "c2f1dbcd-eae3-41e2-92a0-40a949ac856d",
        "from": "age",
        "to": "socioeconomic_status",
        "evidence": "strong"
      },
      {
        "uuid": "01671c89-7605-4d43-90b3-272a293faee6",
        "from": "age",
        "to": "cardiovascular_disease",
        "evidence": "strong"
      },
      {
        "uuid": "17262f42-8fae-45d8-b921-9ce88800c0c1",
        "from": "sex",
        "to": "socioeconomic_status",
        "evidence": "moderate"
      },
      {
        "uuid": "778da8e9-7695-45ba-992a-a34dea159bc4",
        "from": "sex",
        "to": "cardiovascular_disease",
        "evidence": "strong"
      }
    ],
    "dagitty": "dag {\n  socioeconomic_status [exposure]\n  cardiovascular_disease [outcome]\n  socioeconomic_status -> healthcare_access\n  socioeconomic_status -> health_behaviors\n  socioeconomic_status -> psychosocial_stress\n  healthcare_access -> cardiovascular_disease\n  health_behaviors -> cardiovascular_disease\n  psychosocial_stress -> cardiovascular_disease\n  socioeconomic_status -> cardiovascular_disease\n  age -> socioeconomic_status\n  age -> cardiovascular_disease\n  sex -> socioeconomic_status\n  sex -> cardiovascular_disease\n}"
  },
  "computed": {
    "node_count": 7,
    "edge_count": 11,
    "adjustment_sets": {
      "total_effect": [
        [
          "age",
          "sex"
        ]
      ],
      "direct_effect": [
        [
          "healthcare_access",
          "health_behaviors",
          "psychosocial_stress",
          "age",
          "sex"
        ]
      ]
    },
    "conditional_independencies": [
      "healthcare_access ⊥ health_behaviors | socioeconomic_status",
      "healthcare_access ⊥ psychosocial_stress | socioeconomic_status",
      "healthcare_access ⊥ age | socioeconomic_status",
      "healthcare_access ⊥ sex | socioeconomic_status",
      "health_behaviors ⊥ psychosocial_stress | socioeconomic_status",
      "health_behaviors ⊥ age | socioeconomic_status",
      "health_behaviors ⊥ sex | socioeconomic_status",
      "psychosocial_stress ⊥ age | socioeconomic_status",
      "psychosocial_stress ⊥ sex | socioeconomic_status",
      "age ⊥ sex"
    ]
  },
  "git": {
    "md_commit_sha": "f7cd84cf6864466034b85a20f0980a2eb1a13d28"
  },
  "llm": {
    "edge_set_sorted": [
      "age->cardiovascular_disease",
      "age->socioeconomic_status",
      "health_behaviors->cardiovascular_disease",
      "healthcare_access->cardiovascular_disease",
      "psychosocial_stress->cardiovascular_disease",
      "sex->cardiovascular_disease",
      "sex->socioeconomic_status",
      "socioeconomic_status->cardiovascular_disease",
      "socioeconomic_status->health_behaviors",
      "socioeconomic_status->healthcare_access",
      "socioeconomic_status->psychosocial_stress"
    ],
    "text": "DAG: Socioeconomic Status and Cardiovascular Disease. Exposure: socioeconomic_status. Outcome: cardiovascular_disease. Context: general-adults, global, 1990s-present. Edges: age->cardiovascular_disease [strong], age->socioeconomic_status [strong], health_behaviors->cardiovascular_disease [strong], healthcare_access->cardiovascular_disease [strong], psychosocial_stress->cardiovascular_disease [moderate], sex->cardiovascular_disease [strong], sex->socioeconomic_status [moderate], socioeconomic_status->cardiovascular_disease [moderate], socioeconomic_status->health_behaviors [strong], socioeconomic_status->healthcare_access [strong], socioeconomic_status->psychosocial_stress [strong]. Adjustment set (total effect): age, sex. Mediator: healthcare_access, health_behaviors, psychosocial_stress.",
    "body_plain": null
  }
}
